{
  "platform": "Udemy",
  "primary_character": "Kuber Netty",

  "tell": "Course thumbnails include a persistent annotated chalk/whiteboard mark",

  "visual_deviations": [
    "Cleaner workshop visuals with whiteboard/diagram overlays",
    "Neutral, classroom-style lighting",
    "Module-number badge on thumbnails",
    "Simplified, legible typography for captions"
  ],

  "behavioral_deviations": [
    "Structures content into numbered modules and steps",
    "Prioritizes lab reproducibility and explicit learning objectives",
    "References downloadable manifests and exercises frequently"
  ],

  "constraints": [
    "Must remain instructional and curriculum-focused",
    "Avoid short-form slang or social-only tropes",
    "Preserve Netty’s core identity while emphasizing pedagogy"
  ],

  "rendering_guidelines": [
    "Use medium shots and clear diagram overlays",
    "Ensure text is legible at thumbnail sizes",
    "Favor consistent module-number placement and color"
  ],

  "notes": "Udemy avatar for course materials and module thumbnails. Maintained in app context.",

  "version": "1.0",
  "status": "Draft",
  "last_updated": "2026-02-17"
}
