{
  "platform": "TikTok",
  "primary_character": "Kuber Netty",

  "tell": "Shadow lags behind by a fraction of a second during movement",

  "visual_deviations": [
    "Sharper facial features than Netty",
    "Slightly exaggerated jawline",
    "More saturated, high-contrast coveralls",
    "Snappier, more abrupt movements",
    "Cooler, neon tablet screen glow",
    "Hair with subtle unnatural highlight",
    "Shadow delay visible during quick motions"
  ],

  "behavioral_deviations": [
    "Speaks faster and more energetically",
    "Uses shorter, clipped explanations",
    "Sharper, more animated gestures",
    "Frequently taps or points at tablet",
    "Shows mild impatience for slow pacing",
    "Leans forward slightly during instruction"
  ],

  "constraints": [
    "Must maintain fast, high-energy instructional tone",
    "Must avoid long pauses or slow movements",
    "Must match TikTok’s high-contrast visual style",
    "Must remain visually distinct from Patreon avatar",
    "Must preserve the tell at all times",
    "Must not mimic Netty perfectly"
  ],

  "rendering_guidelines": [
    "Use bright, high-contrast lighting",
    "Keep background minimal but dynamic",
    "Favor close-ups and mid-shots",
    "Emphasize quick gestures and transitions",
    "Ensure shadow-lag tell is visible",
    "Use cooler, neon-leaning palette"
  ],

  "notes": "This avatar is permanently bound to Kuber Netty and cannot be reassigned.",

  "version": "1.0",
  "status": "Canonical",
  "last_updated": "2026-02-16"
}
